hotel_id,hotel_name,address,city,state,star_rating,number_of_reviews,rating_average,price
234467,Taman Ahimsa,"Jl. Pantai Mengening, Desa Cemagi, Mengwi, Badung",Bali,Bali,5,1,9.3,211349
235104,Grand Sinar Indah Hotel,"Jl. Padma Utara, Legian Tengah, Kuta",Bali,Bali,3,347,8,129959
235119,The Tanis Villas,Mushroom Bay - Lembongan,Bali,Bali,3,231,7.5,510743
236686,Nunamkhalu Private Villa and SPA,"Jl. Melasti II No. 88, Desa Kutuh, Nusa Dua",Bali,Bali,4,90,7.8,875251
236922,Amos Cozy Hotel Melawai,Melawai Raya 83-85,Jakarta,DKI Jakarta,4,353,6.6,325391
236939,Puteri Gunung Hotel,Jalan Raya Tangkuban Perahu KM 16-17,Bandung,West Java,4,536,7.7,391100
236947,Treva International,"Menteng Raya Street No.33, Kb. Sirih, Menteng, Central Jakarta",Jakarta,DKI Jakarta,4,196,6.4,385360
236968,SanGria Resort and Spa,Jl. Hortikultura No. 88,Bandung,West Java,3,489,7.9,714138
236991,"Sutanraja Hotel, Convention & Recreation","Jl. Raya Manado Bitung, Watutumou II, Kec. Kalawat, Kab Minahasa Utara",Manado,North Sulawesi,4,135,6.3,698868
237063,Swiss-Belinn Medan,Jl. Surabaya No. 88,Medan,North Sumatera,3,3928,7.6,304959
237088,Grasia Hotel,Jalan S. Parman No. 29,Semarang,Central Java,3,191,6.9,175749
237097,Semesta Hotel,Jalan Wahid Hasyim No 125-127,Semarang,Central Java,3,1510,7.2,248747
237189,Abadi Suite Hotel & Tower Jambi by Tritama Hospitality,Jalan Prof. HMO. Bafadhal No.111,Jambi,Jambi,4,239,7.3,249856
237251,Tasik Ria Resort,Jl. Raya Trans Sulawesi,Manado,North Sulawesi,4,50,7.4,669421
237284,Swiss-Belhotel Ambon,Jalan Benteng Kapaha,Ambon,Maluku,4,262,7.6,580165
237328,favehotel MEX Surabaya,Jl. Pregolan 1 - 5,Surabaya,East Java,3,2011,7.3,211560
237450,Grand Orchid Hotel,Jalan Gajah Mada No. 29,Solo (Surakarta),Central Java,3,483,7.1,169364
237503,Batavia Apartments Serviced Residence Jakarta,Jl. K.H. Mas Mansyur Kav. 126,Jakarta,DKI Jakarta,4,2152,7.3,369364
237515,Pandawas Ubud,"Jl.Raya Kendran No.1, Banjar Kepitu, Desa Kendran, Tegallalang",Bali,Bali,4,22,8.1,877871
237522,Collection O 20 Astana Kunti Seminyak,"39, Jl. Dewi Saraswati III, Bali",Bali,Bali,3,670,7.5,207231
237704,Amaris Hotel Panakkukang,3 Jalan Bougenville,Makassar,South Sulawesi,2,206,7,247107
237749,Grand Sahid Jaya Jakarta City Center,JL. Jend. Sudirman Kav. 86,Jakarta,DKI Jakarta,5,2527,7.1,369346
237782,Adiwana Dara Ayu Villas,Jalan Raya Buahan No. 88X Majangan Payangan,Bali,Bali,4,212,8.1,691736
237890,Bidadari Private Villas & Retreat,Kelabang Moding,Bali,Bali,4,210,9.3,1782000
237900,Orchardz Jayakarta Hotel,Pangeran Jayakarta Street No 44,Jakarta,DKI Jakarta,3,1888,7.5,309917
237966,Swiss-Belinn Kristal Kupang,Jl. Timor Raya No. 59,Kupang,East Nusa Tenggara,3,168,6.8,371901
237987,A Residence,"Jl. Pudak Sari, Kartika Plaza",Bali,Bali,3,722,6.8,173004
237994,Handara Golf & Resort Bali,"Pancasari Village, Sukasada, Singaraja",Bali,Bali,3,183,7.2,511976
237995,Hotel Villa Ubud,Br. Pedapdapan,Bali,Bali,4,102,8.5,1404959
238005,Gandasari Hotel,Jl. Seram No. 3,Bandung,West Java,3,433,7.7,177620
238012,Hotel Cihampelas 1,Jl. Cihampelas No. 240,Bandung,West Java,2,278,6.3,391200
238032,The Luxton Hotel,Jl. Ir. H. Juanda No. 18,Bandung,West Java,4,3122,8,332884
238036,Villa Karissa Boutique Hotel,Jalan Drupadi 2 No 100X,Bali,Bali,4,103,7.9,595936
239344,Bali Paradise City Hotel,"Jl. Teuku Umar Barat No. 234, Denpasar",Bali,Bali,3,33,6.3,173660
239352,Grand Sakura Hotel,Jl. Prof. Mohammad Yamin 41 M,Medan,North Sumatera,3,1981,7.5,278721
239393,Gloria Amanda Hotel Yogyakarta,Jalan Sosrowijayan GT I No.195 Kotamadya,Yogyakarta,D.I. Yogyakarta,1,312,6.7,195697
239397,Hermes Palace Hotel Medan,Jalan Pemuda No.22,Medan,North Sumatera,4,800,7.4,383719
239402,Malioboro Inn Hotel,Jalan Sosrowijayan No. 23-25,Yogyakarta,D.I. Yogyakarta,1,188,7.3,191250
239405,Capital O 2023 Medan Ville Hotel.,"BB/1, Taman Multatuli Indah, Jalan Multatuli Blok BB No.1, Hamdan, Medan Maimun, Hamdan, Medan Maimun, Kota Medan, Medan",Medan,North Sumatera,3,243,6.6,278921
239433,Whiz Hotel Malioboro Yogyakarta,Jalan Dagen 8 Malioboro,Yogyakarta,D.I. Yogyakarta,2,2111,7.5,247713
239439,OYO Townhouse 1 Hotel Salemba Near RS PGI Cikini,"Jl. Salemba Raya No.26, RT.4/RW.6. Kenari, Senen, Jakarta Pusat, Central Jakarta, 10430",Jakarta,DKI Jakarta,2,204,7.3,217638
239443,Gino Feruci Kebon Jati Bandung,Kebon Jati Street No. 71 - 73,Bandung,West Java,4,1796,7.3,211368
239456,Gili Exotic Villas,"jalan raya Gili Trawangan, desa gili indah, pemenang",Lombok,West Nusa Tenggara,3,325,8.3,467337
239490,Puri Sari Beach Hotel,"Pede Beach Street, Labuan Bajo-Flores",Labuan Bajo,East Nusa Tenggara,3,620,8.7,343410
239500,Sylvia Hotel Kupang,Jl. Soeharto No. 45 - 53,Kupang,East Nusa Tenggara,3,125,7.5,328162
239516,Hotel Bidakara Grand Pancoran,JL. Gatot Subroto KAV 71-73 Pancoran Jakarta 12870,Jakarta,DKI Jakarta,4,949,7.7,425177
239605,Swiss-Belhotel Kendari,Jl. Edi Sabara No. 88,Kendari,South East Sulawesi,4,227,7.8,491736
239609,Anginsepoi Villa,"Jl. Munduk Kedungu,Banjar Pengembungan Desa PererenaN, Mengwi",Bali,Bali,4,482,8.5,404870
239612,Aston Pontianak Hotel and Convention Center,Jl. Gajah Mada 21,Pontianak,West Kalimantan,4,702,7.7,363540
239613,Aston Tanjung City Hotel,Jl Mabu’un Raya Murung Pudak,Mabuun,South Kalimantan,3,40,7.4,791008
239727,The Edge Bali Villa,"Jl. Pura Gowa Lempeh, Br. Dinas Kangin Pecatu",Bali,Bali,5,72,9.3,8774474
239755,Amaris Hotel Pekanbaru,Jl. K.H Wahid Hasyim No. 30,Pekanbaru,Riau,2,253,7.4,177827
239774,Hotel Palm,Jalan S. Parman No 189,Banjarmasin,South Kalimantan,3,32,6.5,241899
239823,Amertha Bali Villas,"Dusun Pemuteran, Kecamatan Gerokgak, Kabupaten Buleleng",Bali,Bali,4,124,8.6,696138
239850,Hotel Santika Bangka,"Jl. Soekarno Hatta, Km.5 No. 17",Bangka,Bangka Belitung Islands,3,462,7.4,456612
240055,89 Hotel,"Pembangunan Baloi Street, Block VI, Penuin",Batam Island,Riau Islands,3,2826,7.7,267524
240073,The Jas Villas,"Jalan Laksmana Gang Bugis, Seminyak, Bali, Indonesia",Bali,Bali,4,1281,7.6,660124
240074,The Purist Villas & Spa,Jl. Tirta Tawar Banjar Kutuh Kaja,Bali,Bali,4,125,9.1,1315994
240077,Asmila Boutique Hotel,Jl. Dr. Setiabudhi no. 54,Bandung,West Java,4,752,7.5,315336
240083,Bentani Hotel & Residence,Siliwangi 69,Cirebon,West Java,3,416,8.1,486846
240093,Golden View Hotel,Jl. Bengkong Laut,Batam Island,Riau Islands,4,1321,7.8,357025
240095,Grage Hotel Cirebon,Jln. RA. Kartini no. 77,Cirebon,West Java,4,585,8.1,487224
240258,Hotel Mawar Asri Yogyakarta,Jalan H. Agus Salim No. 40 Notoprajan Ngampilan,Yogyakarta,D.I. Yogyakarta,2,203,7.1,141322
240289,Hotel Ayu Beach Inn,Jalan Popies I,Bali,Bali,1,41,6.4,268790
240300,Grand Menteng Hotel,Jl. Matraman Raya No. 21,Jakarta,DKI Jakarta,3,108,6.5,217638
240325,The Akasha Luxury Villas,Jl.Batu Belig No.999ab,Bali,Bali,5,164,8.4,3706309
